{
  "id": "custom-tag-pass",
  "kind": "gamepass",
  "name": "Custom Tag",
  "summary": "A tag of your own above your name.",
  "trust": "unconfirmed",
  "sources": [
    "wiki-game-passes"
  ],
  "last_updated": "2026-10-27",
  "grants": [
    "A custom tag, replacing any other tag"
  ],
  "commands": [
    {
      "cmd": "/tag <text>",
      "does": "Set your tag"
    },
    {
      "cmd": "/tag <RGB> <text>",
      "does": "Set it in a colour"
    },
    {
      "cmd": "/edittag",
      "does": "Edit it"
    },
    {
      "cmd": "/Retag",
      "does": "Remove it"
    }
  ],
  "robux": 395,
  "robux_premium": 356
}
